{
  "schema_version": "doctore.model-output.v1",
  "event_id": "NBA-EXAMPLE-001",
  "market_id": "NBA-EXAMPLE-001-TOTAL-224.5-OVER",
  "model_name": "doctore-nba-total-xgb",
  "model_version": "1.4.2-example",
  "sport": "NBA",
  "competition": "NBA",
  "market_type": "game_total",
  "target_market": "full_game_total",
  "period": "full_game_including_overtime",
  "line": 224.5,
  "settlement_rules": "including_overtime_push_on_exact_integer_total",
  "selection": "over",
  "probability_raw": 0.509090909090909,
  "probability_calibrated": null,
  "calibration_status": "uncalibrated",
  "calibration_method": "none",
  "prediction_generated_at": "2026-07-23T15:41:00+03:00",
  "feature_cutoff_at": "2026-07-23T15:38:00+03:00",
  "training_cutoff_at": "2026-01-08T01:00:00+00:00",
  "feature_schema_version": "nba-total-features-v7",
  "validation_domain": {
    "sport": "NBA",
    "competition": "NBA",
    "market_type": "game_total",
    "target_market": "full_game_total",
    "period": "full_game_including_overtime",
    "line": 224.5,
    "settlement_rules": "including_overtime_push_on_exact_integer_total"
  },
  "validation_window": "2026-01-05T14:00:00+00:00/2026-01-08T01:00:00+00:00",
  "validation_sample_size": 60,
  "brier_score": 0.2557250183139057,
  "log_loss": 0.7053946006890564,
  "expected_calibration_error": 0.1082918962379642
}
